IncidentNum,Date,time,County,Location,Mode,Injury,Depth,Species,Comment,Longitude,Latitude,Fatal,Species_simplified,Depth_simplified,Moon Phase,Percent Full
133,2009-10-24,17:30:00,San Diego,San Onofre State Beach,Surfing / Boarding,minor,surface,Unknown,"3 puncture wounds to big toe of left foot, and laceration on arch of foot",-117.8,33.37,No,Other,Surface,WAXING CRESCENT,37.3
134,2009-11-05,17:00:00,Santa Cruz,Davenport,Surfing / Boarding,none,surface,White,"No injury, board broken in half",-122.6533333,37.05,No,White,Surface,WANING GIBBOUS,89.87
135,2010-07-02,15:15:00,San Diego,San Onofre State Beach,Paddleboarding,none,surface,White,Shark bumped and turned board without injury,-117.9,33.37,No,White,Surface,WANING GIBBOUS,68.2
136,2010-07-02,18:30:00,San Luis Obispo,Pismo Beach,Surfing / Boarding,minor,surface,Leopard,Shark bit surfer and was picked up in surfer's hand. Laceration to left foot; Definite Leopard Shark,-120.8466667,35.13833333,No,Other,Surface,WANING GIBBOUS,68.2
137,2010-08-02,12:40:00,Santa Barbara,"Near Oil Rig Hondo, Gaviota",Kayaking / Canoeing,none,surface,White,"No injury, kayak bitten",-120.122,34.397,No,White,Surface,WANING GIBBOUS,54.45
138,2010-08-14,10:00:00,San Mateo,Pigeon Point,Kayaking / Canoeing,none,surface,White,"No injury, kayak bitten",-122.7083333,37.19166667,No,White,Surface,WAXING CRESCENT,27.57
139,2010-10-22,9:00:00,Santa Barbara,"Surf Beach, Lompoc",Surfing / Boarding,fatal,surface,White,"Shark bit boogie boarder, dragging him underwater. Major injuries to thighs and legs.",-120.71,34.683,Yes,White,Surface,FULL,100
140,2011-06-06,17:00:00,San Diego,"La Jolla, Children's Pool",Freediving,none,surface,Sevengill,"Sevengill shark bit spear fisherman's leg, marking wetsuit but no injury",-117.68,32.855,No,Other,Surface,WAXING CRESCENT,24.07
141,2011-06-24,13:30:00,San Diego,San Onofre State Beach,Surfing / Boarding,none,surface,White,Shark leapt onto surfboard; surfer uninjured ,-118,33.37,No,White,Surface,WANING CRESCENT,39.01
142,2011-09-11,12:30:00,Humboldt,Samoa Beach,Surfing / Boarding,none,surface,White,"No injury, board bitten",-124.204,40.8,No,White,Surface,FULL,100
143,2011-10-29,7:00:00,Monterey,Marina State Beach,Surfing / Boarding,major,surface,White,Shark bit surfers board with major injuries to neck and arm,-121.9,36.7,No,White,Surface,WAXING CRESCENT,11.41
144,2011-11-22,11:30:00,San Mateo,Pigeon Point,Kayaking / Canoeing,none,surface,White,"No injury, kayak bitten",-122.8083333,37.19166667,No,White,Surface,WANING CRESCENT,9.44
145,2012-05-06,7:30:00,Island - Catalina,Catalina Island,Paddleboarding,none,surface,White,"Paddle boarding, No injury, shark bit paddleboard",-118.5163,33.3879,No,White,Surface,FULL,100
146,2012-05-12,13:30:00,San Luis Obispo,"Cambria, Leffingwell Landing",Kayaking / Canoeing,none,surface,White,"Shark hit kayak, ejecting occupant without injury",-121.122,35.583,No,White,Surface,WANING GIBBOUS,52.56
147,2012-07-07,8:30:00,Santa Cruz,"Santa Cruz, Pleasure Point",Kayaking / Canoeing,none,surface,White,"Shark hit kayak, ejecting occupant without injury; tooth fragment in kayak",-121.995,36.96,No,White,Surface,WANING GIBBOUS,81.77
148,2012-07-31,6:45:00,Los Angeles,Topanga Beach,Surfing / Boarding,minor,surface,Unknown,"Surfer knocked off board when something struck surfboard, minor abrasion to hand",-118.6,34,No,Other,Surface,FULL,97.18
149,2012-10-07,18:30:00,Santa Cruz,Davenport Landing,Surfing / Boarding,none,surface,White,"No injury to boardrider, shark struck board breaking the mast",-122.7533333,37.05,No,White,Surface,WANING GIBBOUS,56.11
150,2012-10-23,11:00:00,Santa Barbara,"Surf Beach, Lompoc",Surfing / Boarding,fatal,surface,White,Shark bit surfers legs to torso with fatal injuries and mark on board,-120.81,34.683,Yes,White,Surface,WAXING GIBBOUS,66.19
152,2013-06-25,16:00:00,San Mateo,"San Pedro Point, Pacifica",Kayaking / Canoeing,none,surface,White,"Shark bit kayak, no injury but marks on kayak",-122.617,37.59666667,No,White,Surface,WANING GIBBOUS,92.76
153,2013-08-17,13:00:00,San Mateo,"Half Moon Bay, Pillar Point",Surfing / Boarding,none,surface,White,"Shark bumped board, throwing surfer and was seen shortly afterwards",-122.799,37.492,No,White,Surface,WAXING GIBBOUS,84
154,2013-08-31,23:00:00,Santa Barbara,"Butterfly Beach, Santa Barbara",Swimming,minor,surface,Salmon,"Swimmer was bitten on foot, later a salmon shark washed ashore with matching dentition",-119.6492,34.4176,No,Other,Surface,WANING CRESCENT,20.89
156,2014-07-05,7:30:00,San Luis Obispo,"Oceano Dunes State Beach, Oceano",Surfing / Boarding,none,surface,White,Shark bit surfboard but surfer was uninjured,-120.635,35.11,No,White,Surface,WAXING GIBBOUS,51.75
157,2014-09-13,18:45:00,Santa Cruz,Santa Cruz - Manresa Beach,Surfing / Boarding,none,surface,White,Shark bit surfboard knocking surfer into water with no injuries,-122,36.7,No,White,Surface,WANING GIBBOUS,73.95
158,2014-10-02,17:30:00,Santa Barbara,Vandenberg AFB,Surfing / Boarding,minor,surface,White,Surfer bitten in knee with minor puncture wound,-120.64,34.76,No,White,Surface,WAXING GIBBOUS,59.66
159,2014-10-03,11:00:00,Santa Barbara,Vandenberg AFB,Kayaking / Canoeing,none,surface,White,"Shark bit kayak ejecting kayaker into water, second attack in same location on same day",-120.74,34.76,No,White,Surface,WAXING GIBBOUS,70.62
160,2014-10-03,14:00:00,Santa Barbara,Vandenberg AFB,Kayaking / Canoeing,none,surface,White,"Shark bit kayak peddle drive, ejecting kayaker into water with no injuries",-120.84,34.76,No,White,Surface,WAXING GIBBOUS,70.62
161,2014-10-19,14:30:00,Santa Barbara,Leadbetter Point,Kayaking / Canoeing,none,surface,White,"Shark bit outrigger canoe with teeth marks and punctures, no injuries",-119.701,34.398,No,White,Surface,WANING CRESCENT,16.59
162,2014-12-28,11:30:00,San Luis Obispo,Montana de Oro State Park,Surfing / Boarding,major,surface,White,Shark bit board and surfer with injuries to hip requiring hospitalization,-120.892,35.276,No,White,Surface,WAXING CRESCENT,49.17
163,2015-07-10,8:45:00,Orange,Huntington Beach-Lifeguard Tower 17,Surfing / Boarding,none,surface,White,"Shark bumped board, leaving marks",-118.3,33.7,No,White,Surface,WANING CRESCENT,30.04
164,2015-08-18,7:30:00,Santa Barbara,Gaviota State Beach,Kayaking / Canoeing,none,surface,White,"Shark bit kayak, leaving marks",-120.21,34.367,No,White,Surface,WAXING CRESCENT,14.28
165,2015-08-29,10:15:00,San Luis Obispo,"Morro Rock, Morro Bay",Surfing / Boarding,none,surface,White,Shark bit surfboard but surfer was uninjured,-121.075,35.40333333,No,White,Surface,FULL,100
166,2015-09-05,15:00:00,Ventura,"Deer Creek, Malibu/Ventura",Kayaking / Canoeing,minor,surface,Hammerhead,Shark bit kayakers foot dangling in water with minor injuries - shark seen and identified as hammerhead,-118.9986,34.0514,No,Other,Surface,WANING CRESCENT,47.26
167,2015-09-06,17:30:00,Los Angeles,"El Pescador State Beach, Malibu",Paddleboarding,none,surface,White,"Shark hit board, knocking paddler into water - Lot's of follow-up on other websites, but no additional confirmation",-118.894,34.038,No,White,Surface,WANING CRESCENT,36.83
168,2015-09-20,11:00:00,Island - Santa Cruz,Yellow Banks,Freediving,minor,surface,Hammerhead,"Shark hit spearfisherman with fish on belt on diver's right side, repeatedly attempted to bite again, diver shoved fish in shark's mouth and swam to boat, minor lacerations to right leg",-119.55,34,No,Other,Surface,WAXING CRESCENT,42.84
169,2015-09-24,11:00:00,Santa Barbara,"Horseshoe Rock, Santa Barbara",Kayaking / Canoeing,minor,surface,White,"Shark bit kayak, kayaker received minor scrape and dislocated thumb. Kayak marked",-119.595,34.417,No,White,Surface,WAXING GIBBOUS,83.26
170,2016-05-29,15:00:00,Orange,Corona del Mar State Beach,Swimming,major,surface,White,"Attacked while Swimming on surface, Broken ribs, torso injuries, broken pelvis",-117.8755,33.5933,No,White,Surface,WANING CRESCENT,48.28
171,2016-09-01,9:00:00,Santa Barbara,Refugio State Beach,Freediving,minor,surface,White,Shark bit then repeatedly bumped free diver; broken toes and lacerations,-120.075,34.46,No,White,Surface,NEW,0
173,2017-03-18,16:30:00,Monterey,"San Carlos Beach, Monterey",Kayaking / Canoeing,none,surface,White,Shark attacked kayak - knocking rider into water without injury. Continued to bite kayak for several minutes,-121.95,36.62666667,No,White,Surface,WANING GIBBOUS ,68.53
175,2017-07-11,11:00:00,Santa Cruz,"Santa Cruz, Steamer Lane""""""""",Kayaking / Canoeing,none,surface,White,"Shark bumped then bit kayak, throwing kayaker into water",-121.895,36.96,No,White,Surface,WANING GIBBOUS,94.12
176,2017-07-20,8:00:00,Santa Barbara,Goleta Beach,Paddleboarding,none,surface,White,"Shark bit paddleboard, removing nose of board but not injuring boarder. Approximately 8'",-119.8,34.398,No,White,Surface,WANING CRESCENT,10.82
177,2017-07-20,11:15:00,Santa Barbara,"Stearns Warf, Santa Barbara",Kayaking / Canoeing,none,surface,White,"Shark bit kayak, kayaker jumped off and swam to nearby boat. No injury",-119.9,34.398,No,White,Surface,WANING CRESCENT,10.82
178,2017-08-01,10:45:00,San Mateo,Pigeon Point/Bean Hollow,Kayaking / Canoeing,none,surface,White,"Shark hit kayak, knocking kayaker into the water without injury",-122.9083333,37.19166667,No,White,Surface,WAXING GIBBOUS,68.98
179,2017-11-24,13:30:00,Monterey,Pebble Beach,Freediving,major,surface,White,"Shark buzzed diver at 30-40 feet deep, then bit leg when on surface, major injury but leg saved; confirmed white through DNA sample",-121.9423722,36.56425,No,White,Surface,WAXING CRESCENT,31.12
180,2017-12-30,15:00:00,Marin,Drake's Estero,Surfing / Boarding,minor,surface,White,"Shark bit surfers foot with minor damage to toes. Surfer hit shark, estimated 12'. Refused treatment",-122.9417,38.0278,No,White,Surface,WAXING GIBBOUS,91.46
181,2018-06-25,18:00:00,San Diego,Oceanside,Kayaking / Canoeing,none,surface,Unknown,"Shark bit outrigger canoe with teeth marks and punctures, no injuries",-117.430831,33.187739,No,Other,Surface,WAXING GIBBOUS,94.03
182,2018-08-24,20:00:00,Orange,Huntington Beach,Swimming,none,surface,White,"Boy wading in ocean saw shark approach and bump him, no injuries",-118.4,33.7,No,White,Surface,FULL,96.96
183,2018-09-29,7:00:00,San Diego,Beacon's Beach - Encinitas,Freediving,major,surface,White,Freediving for lobster - shark bit upper torso with major injuries to shoulder. Rescued by nearby divers/kayakers - presumed white,-117.3047,33.0652,No,White,Surface,WANING GIBBOUS,78.75
184,2018-10-23,10:00:00,Island - Farallones,Farallon Islands,Scuba Diving,major,Unknown,White,17 foot white shark bit diver in hand/arm diver helicoptered to shore,-123.6316667,37.72,No,White,Unknown,FULL,98.78
185,2019-01-08,14:00:00,San Luis Obispo,Montana de Oro State Park,Surfing / Boarding,major,surface,White,"15 foot white shark bit surfer in legs. Surfer able to swim to beach and drive to hospital, 50 stiches in legs",-120.992,35.276,No,White,Surface,WAXING CRESCENT,6.23
186,2019-05-07,NULL,Sonoma,Salmon Creek Beach,Surfing / Boarding,none,surface,White,"White shark bit surfers leash, shook board, no injury",-123.6766667,38.35833333,No,White,Surface,WAXING CRESCENT,8.29
187,2019-09-01,12:00:00,San Diego,Solana Beach,Surfing / Boarding,none,surface,Thresher,"Surfer saw 8' shark with very long tail. As he tried to paddle away, shark bumped board then hit his leg with tail several times before swimming away",-117.4,33,No,Other,Surface,WAXING CRESCENT,7.51
188,2019-10-05,8:00:00,Island - Catalina,Ship Rock,Kayaking / Canoeing,none,surface,White,"Approximately 10 foot Shark bit kayak and pushed it leaving marks and teeth, no injury",-118.4917,33.4625,No,White,Surface,WAXING GIBBOUS,59.45
189,2019-12-21,15:15:00,Island - Santa Rosa,Talcott Shoals,Surfing / Boarding,major,surface,White,"Approximately 15 foot shark bit surfer on upper thigh, rescued by buddy on boat and airlifted by USCG",-120.23333,34.01667,No,White,Surface,WANING CRESCENT,23.01
190,2020-03-27,19:00:00,Santa Cruz,"Santa Cruz, Pleasure Point",Paddleboarding,none,surface,White,"Shark bit a lay-down paddle board, knocking boarder into water, no injury",-122.095,36.96,No,White,Surface,WAXING CRESCENT,9.39
191,2020-05-01,14:30:00,Santa Barbara,"Padaro Lane, Carpenteria",Swimming,minor,surface,White,"Swimmer bumped by approximately 5' long shark, with dark dorsal, in areas where several young white sharks seen earlier, minor laceration to foot",-119.695,34.41333,No,White,Surface,WAXING GIBBOUS,59.09
192,2020-05-09,13:30:00,Santa Cruz,Manresa State Beach - Sand Dollar Beach,Surfing / Boarding,fatal,surface,White,"Surfer bitten in leg pronounced dead on scene, no witnesses of the shark but white sharks known to be in area - Presumed white",-121.8558,36.919966,Yes,White,Surface,WANING GIBBOUS,93.22
193,2020-05-25,7:30:00,Humboldt,Shelter Cove,Kayaking / Canoeing,none,surface,White,"Kayak bitten and punctured. Kayaker hit shark. Kayak took on water, and kayaker rescued by boater",-124.283333,40.028333,No,White,Surface,WAXING CRESCENT,8.66
194,2020-06-19,16:00:00,Island - Santa Cruz,San Pedro Point,Scuba Diving,none,35,White,"David Kushner, bumped on upper right side of body from behind while spearfishing for halibut then shark swam in front of him and away. ",-119.52207,34.034931,No,White,31-40,WANING CRESCENT,27.6
195,2020-08-12,17:42:00,Los Angeles,"Bluff Cove, Palos Verdes",Freediving,minor,surface,White,"Free diving spear fisherman had fish on a stringer and a 7-8' white shark grabbed fish, retreated when hit, then approached again. Stringer caused minor cut to fisherman's leg.",-118.4089628,33.79,No,White,Surface,WANING CRESCENT,40.71
196,2020-08-28,17:00:00,Humboldt,Shelter Cove,Kayaking / Canoeing,none,surface,White,Kayak bitten and punctured. Kayaker thrown into water but able to get back on without injury,-124.383333,40.028333,No,White,Surface,WAXING GIBBOUS,79.78
197,2020-12-30,14:00:00,San Diego,Coronado,Swimming,none,surface,White,Swimmer's fin bitten by juvenile white shark while swimming on surface. Not injury,-117.316667,32.685,No,White,Surface,FULL,100
198,2021-06-26,9:00:00,San Mateo,Gray Whale State Beach (Devil's Slide),Freediving,major,surface,White,"Snorkeler was bitten on upper thigh, swam in to beach where fisherman assisted until emergency crews arrived. Originally reported as swimmer, then surfer.",-122.615003,37.564967,No,White,Surface,WANING GIBBOUS,94.92
199,2021-06-30,7:15:00,Island - Catalina,Parson's Landing,Kayaking / Canoeing,minor,surface,White,"Canoer from boy scout camp was bitten on hand after feeling something bump boat, airlifted due to remote location but not for major injury. Location from LA life guards Parson's Landing",-118.55,33.47,No,White,Surface,WANING GIBBOUS,62.12
200,2021-07-05,9:15:00,San Luis Obispo,"Cambria, Leffingwell Landing",Kayaking / Canoeing,none,surface,White,"Kayaker was struck from below, knocked into water, and bumped by shark. Shark then came back, grabbed kayak and pushed it 30 feet. No injury",-121.222,35.583,No,White,Surface,WANING CRESCENT,16.95
201,2021-07-22,11:15:00,Monterey,Moss Landing Jetty,Surfing / Boarding,none,surface,Unknown,"Surfer was paddling and felt something hit his board, when he got to shore there were tooth marks, CDFW forensics lab could not detect WS DNA",-121.7917,36.8076,No,Other,Surface,FULL,97.16
202,2021-10-03,9:00:00,Sonoma,Salmon Creek Beach,Surfing / Boarding,major,surface,White,White shark bit surfer on leg/thigh with major injuries. Surfer medivaced to hospital. CDFW confirmed species from DNA,-123.7766667,38.35833333,No,White,Surface,WANING CRESCENT ,9.89
204,2021-12-24,10:40:00,San Luis Obispo,Morro Strand State Beach,Surfing / Boarding,fatal,surface,White,Surfer found victim face down in water. Signficant injuries to chest and pronounced dead at scene. Species confirmed through DNA by CDFW.,-121.175,35.40333333,Yes,White,Surface,WANING GIBBOUS,73.9
205,2022-02-26,11:30:00,Island - San Miguel,San Miguel Island - Northeast side,Scuba Diving,major,surface,White,"Diver bitten on right foot by 12-14' white shark while on surface. Bleeding controlled on site, medevaced by USCG to Santa Barbara",-120.8366667,34.04,No,White,Surface,WANING CRESCENT,20.13