IncidentNum,Date,time,County,Location,Mode,Injury,Depth,Species,Comment,Longitude,Latitude,Fatal,Species_simplified,Depth_simplified,Moon Phase,Percent Full
1,1950-10-08,12:00:00,San Diego,Imperial Beach,Swimming,major,surface,White,"Body Surfing, bit multiple times on leg, thigh and body",-117.1466667,32.58833333,No,White,Surface,WANING CRESCENT,10.9
2,1952-05-27,14:00:00,San Diego,Imperial Beach,Swimming,minor,surface,White,Foot & swim fin bitten,-117.2466667,32.58833333,No,White,Surface,WAXING CRESCENT,13.91
3,1952-12-07,14:00:00,Monterey,Lovers Point,Swimming,fatal,surface,White,"Attacked from below then second time from front, fatal",-122.05,36.62666667,Yes,White,Surface,WANING GIBBOUS,66.9
4,1955-02-06,12:00:00,Monterey,Pacific Grove,Freediving,minor,surface,White,"Attacked from behind, lost swim fin",-122.15,36.62666667,No,White,Surface,FULL,100
5,1956-08-14,16:30:00,San Luis Obispo,Pismo Beach,Swimming,major,surface,White,Large (9 ft) shark attacked side and hands in shallow water,-120.6466667,35.13833333,No,White,Surface,WAXING GIBBOUS,62.73
6,1957-04-28,13:30:00,San Luis Obispo,Morro Bay,Swimming,fatal,surface,White,"First hand accounts suggest a large white shark, bit swimmer's arm, victim never found",-120.875,35.40333333,Yes,White,Surface,NEW,1.89
7,1958-10-12,NULL,San Diego,Coronado Strand,Swimming,major,surface,White,Shark bit swimmer multiple times on leg and torso,-117.2166667,32.685,No,White,Surface,NEW,0
8,1959-05-07,17:30:00,San Francisco,Baker Beach,Swimming,fatal,surface,White,Shark bit swimmer multiple times ,-122.4836,37.7936,Yes,White,Surface,NEW,0
9,1959-06-14,17:00:00,San Diego,La Jolla,Freediving,fatal,surface,White,"Free diver bit, dragged to bottom and not recovered, eyewitness reports",-117.28,32.855,Yes,White,Surface,WAXING GIBBOUS,54.88
10,1959-07-28,19:30:00,San Diego,La Jolla,Freediving,minor,surface,Hammerhead,Hammerhead bit thigh. Diver saw shark during and after attack,-117.38,32.855,No,Other,Surface,WANING CRESCENT,39.92
11,1959-10-04,15:00:00,Sonoma,Bodega Rock,Freediving,none,surface,White,"Large shark grabbed fin, no injury",-123.0466667,38.295,No,White,Surface,WAXING CRESCENT,6.42
12,1959-11-10,10:30:00,Los Angeles,"Malibu, Paradise Cove",Freediving,minor,surface,Blue,"Blue shark bit arm and released, minor injuries",-118.7833333,34.01833333,No,Other,Surface,WAXING GIBBOUS,80.48
13,1960-04-24,14:00:00,Marin,Tomales Point,Freediving,minor,surface,White,Shark bit fin and diver's heel,-122.965,38.18166667,No,White,Surface,NEW,1.55
14,1960-05-19,13:00:00,Santa Cruz,"Santa Cruz, Hidden Beach, Aptos",Swimming,major,surface,White,"Shark bit swimmer's leg, which was later amputated below the knee",-122.095,36.96,No,White,Surface,WANING CRESCENT,30.8
15,1961-05-21,8:30:00,Marin,Tomales Point,Freediving,none,25,White,"Shark bit abalone diver's weight belt, no injuries",-123.065,38.18166667,No,White,21-30,WAXING CRESCENT,40.46
16,1961-08-20,9:30:00,Sonoma,Salmon Creek Beach,Swimming,major,surface,White,Shark bit swimmer's groin and leg with major injuries to the foot and other lacerations,-123.0766667,38.35833333,No,White,Surface,WAXING GIBBOUS,63.01
17,1962-01-14,10:30:00,Island - Farallones,Farallon Islands,Scuba Diving,major,surface,White,Spearfishing free diver bitten severely in Leg,-123.0316667,37.72,No,White,Surface,WAXING GIBBOUS,66.22
18,1962-11-11,12:45:00,Island - Farallones,Farallon Islands,Scuba Diving,major,surface,White,SCUBA diver attacked at surface and bitten in multiple locations,-123.1316667,37.72,No,White,Surface,FULL,100
19,1964-01-11,12:00:00,Island - Farallones,Farallon Islands,Scuba Diving,major,surface,White,Shark bit SCUBA diver on surface then circled and approached several times. Major injuries to legs,-123.2316667,37.72,No,White,Surface,WANING CRESCENT,9.19
20,1966-01-22,11:00:00,Monterey,Cypress Point,Freediving,major,surface,White,Shark bit free diver at surface injuring thigh and arm,-122.0423722,36.58333333,No,White,Surface,NEW,1.02
21,1968-07-27,11:00:00,Sonoma,Bodega Rock,Freediving,major,20,White,Shark bit free dive near bottom with major injuries to chest and back,-123.1466667,38.295,No,White,11-20,NEW,4.96
23,1969-09-06,11:20:00,Marin,Tomales Point,Freediving,major,surface,White,"Free diver near surface, major injuries to legs",-123.165,38.18166667,No,White,Surface,WANING CRESCENT,23.3
24,1971-07-19,NULL,Santa Barbara,Purisma Point,Hookah Diving,major,20,White,"Shark attacked abalone Hookah Diving diver on bottom, major injuries to head, back and buttocks. Incorrectly reported in Miller/Collier as 1972",-120.6416667,34.75833333,No,White,11-20,WANING CRESCENT,8.16
25,1971-10-02,14:00:00,Sonoma,Sea Ranch,Scuba Diving,major,15,White,"SCUBA Diver near bottom, both legs with deep cuts",-123.43,38.66666667,No,White,11-20,WAXING GIBBOUS,94.9
26,1972-05-28,13:30:00,Marin,Tomales Point,Freediving,major,surface,White,"Free Diver at surface, Major injuries to thighs",-123.265,38.18166667,No,White,Surface,FULL,100
28,1974-05-26,11:30:00,Marin,Tomales Point,Freediving,major,surface,White,"Free diver at surface, injuries to legs",-123.365,38.18166667,No,White,Surface,WAXING CRESCENT,29.13
29,1974-07-26,NULL,Mendocino,Albion,Freediving,minor,25,White,"Shark grabbed free diver's foot on descent, minor injuries",-123.7766667,39.22833333,No,White,21-30,WAXING GIBBOUS,55.25
30,1974-08-05,NULL,San Mateo,San Gregorio State Beach,Surfing / Boarding,minor,surface,White,Shark bit surfer's board with minor laceration to hand,-122.4083333,37.32333333,No,White,Surface,WANING GIBBOUS,94.36
31,1974-09-02,17:30:00,San Mateo,Franklin Point,Scuba Diving,minor,surface,White,"2 SCUBA divers at surface, shark bit first diver on foot and second on hand, minor injuries",-122.3666667,37.15,No,White,Surface,FULL,99.31
32,1974-09-02,17:30:00,San Mateo,Franklin Point,Scuba Diving,minor,surface,White,"2 SCUBA divers at surface, shark bit first diver on foot and second on hand, minor injuries",-122.4666667,37.15,No,White,Surface,FULL,99.31
33,1974-09-14,13:35:00,Island - Farallones,Farallon Islands,Hookah Diving,major,28,White,"Hookah diver on bottom, major injuries to arms and thigh",-123.3316667,37.72,No,White,21-30,NEW,3.11
34,1974-09-28,7:30:00,Monterey,Point Sur,Surfing / Boarding,major,surface,White,Surfer bitten on legs with major injuries,-121.9966667,36.31333333,No,White,Surface,WAXING GIBBOUS,92.71
35,1975-07-19,13:30:00,Santa Barbara,"Point Conception, Perch Rock",Hookah Diving,none,30,White,"Abalone Hookah diver, bitten on fin with minor injury",-120.475,34.45,No,White,21-30,WAXING GIBBOUS,87.24
36,1975-07-23,14:30:00,Santa Barbara,Point Conception,Scuba Diving,major,surface,White,Shark attacked SCUBA diver at surface with major injuries to legs,-120.575,34.45,No,White,Surface,FULL,100
37,1975-08-09,13:30:00,Mendocino,Usal Creek,Freediving,major,19,White,"Abalone free diver at surface, major injuries to hand and arm",-123.8566667,39.82,No,White,11-20,WAXING CRESCENT,6.97
38,1975-12-06,12:00:00,Island - Farallones,Farallon Islands,Scuba Diving,major,20,White,Shark attacked SCUBA diver underwater with injuries to leg,-123.4316667,37.72,No,White,11-20,WAXING CRESCENT,15.34
39,1976-10-18,14:30:00,Humboldt,Moonstone Beach,Surfing / Boarding,minor,surface,White,Surfer bitten on legs with minor injuries,-124.1116667,41.025,No,White,Surface,WANING CRESCENT,25.35
40,1976-10-18,9:00:00,Island - San Miguel,San Miguel Island,Hookah Diving,major,18,White,Hookah diver bitten underwater with major injuries to thighs and buttocks,-120.4366667,34.04,No,White,11-20,WANING CRESCENT,25.35
41,1977-08-14,NULL,Marin,Tomales Point,Freediving,major,surface,White,"Abalone Free diver near surface, with major injuries to legs",-123.465,38.18166667,No,White,Surface,NEW,0
42,1978-08-05,12:45:00,Santa Cruz,Pajaro Dunes,Swimming,minor,surface,Unknown,"Body Surfing / Boarding, about to stand and bit on leg, minor injuries. Bite size indicates a smaller shark, possibly not white",-121.81,36.86,No,Other,Surface,NEW,2.8
43,1979-03-11,10:00:00,San Mateo,Ano Nuevo Island,Scuba Diving,none,20,White,"Shark grabbed SCUBA divers fin underwater, without injury",-122.3433333,37.10833333,No,White,11-20,FULL,99.42
44,1980-10-17,9:30:00,Humboldt,Moonstone Beach,Surfing / Boarding,none,surface,White,Surfer's board grabbed without injury,-124.2116667,41.025,No,White,Surface,WAXING GIBBOUS,56.8
45,1981-12-19,NULL,Monterey,Spanish Bay,Surfing / Boarding,fatal,surface,White,Surfer found dead with major wound and surfboard indicating large white shark,-122.25,36.62666667,Yes,White,Surface,WANING CRESCENT,34.52
46,1982-02-07,11:00:00,Sonoma,Stillwater Cove,Scuba Diving,major,40,White,SCUBA diver grabbed by leg on descent with major injuries to thigh and leg,-123.305,38.54333333,No,White,31-40,FULL,100
47,1982-07-24,11:00:00,San Luis Obispo,Point Buchon,Paddleboarding,none,surface,White,Shark grabbed large paddle board with no injury,-120.9066667,35.23666667,No,White,Surface,WAXING CRESCENT,20.83
48,1982-09-19,NULL,Mendocino,Bear Harbor,Freediving,major,12,White,Free diver bitten on descent with major lacerations to buttocks,-123.9333333,39.93333333,No,White,11-20,WAXING CRESCENT,6.25
49,1982-09-25,8:00:00,Monterey,Monastery Beach,Scuba Diving,minor,40,White,Shark bumped diver underwater Diver pushed away and received lacerations to hand,-121.9266667,36.52666667,No,White,31-40,WAXING GIBBOUS,55.88
50,1984-09-15,8:30:00,San Mateo,Pigeon Point,Freediving,fatal,surface,White,"Shark attacked diver on mat at surface, dragging him away then releasing, Multiple major lacerations leading to death.",-122.5083333,37.19166667,Yes,White,Surface,WANING GIBBOUS,74.86
51,1984-09-17,15:30:00,San Diego,Mission Beach,Swimming,minor,surface,Blue,"Shark bit wading swimmer. Minor injuries to arm. Bite size indicative of a smaller shark, possible blue",-117.2566667,32.785,No,Other,Surface,WANING GIBBOUS,56.08
52,1984-09-30,10:00:00,Marin,Tomales Point,Freediving,major,10,White,"Free diver underwater, numerous lacerations to back, buttock, thighs",-123.565,38.18166667,No,White,0-10,WAXING CRESCENT,38.34
53,1985-02-18,NULL,Island - San Miguel,San Miguel Island,Scuba Diving,minor,surface,White,Diver observed shark underwater then was struck at surface with no injuries. Tank marked by shark's teeth,-120.5366667,34.04,No,White,Surface,NEW,0.88
54,1985-05-26,11:00:00,Orange,Seal Beach,Surfing / Boarding,minor,surface,Unknown,Surfer noted boil in water then fell off board and received a single gash to leg possible not shark,-118.1,33.75,No,Other,Surface,WAXING CRESCENT,41.8
55,1985-09-28,NULL,Marin,"Tomales Point, Elephant Rock",Freediving,none,14,White,"Shark bumped diver, but swam off with no injuries",-123.665,38.18166667,No,White,11-20,FULL,100
56,1985-10-22,16:00:00,Santa Barbara,Point Conception,Hookah Diving,minor,15,Unknown,"Hookah diving, Minor injury to foot & ankle Possibly six/seven gill shark",-120.675,34.45,No,Other,11-20,WAXING GIBBOUS,69.89
57,1986-12-06,9:00:00,Monterey,Monastery Beach,Freediving,major,38,White,"Diver on bottom, major bites to chest, arms, upper body",-122.1266667,36.52666667,No,White,31-40,WAXING CRESCENT,33.62
58,1987-08-15,7:30:00,San Mateo,"Half Moon Bay, Tunitas Creek",Surfing / Boarding,minor,surface,White,"Shark grabbed surfer's board, minor scrapes to fingers",-122.499,37.492,No,White,Surface,WANING CRESCENT,29.93
59,1987-10-26,17:00:00,Santa Cruz,Davenport Light,Surfing / Boarding,minor,surface,White,"Shark grabbed surfer upper left leg and continued to heel, minor injuries, small shark",-122.2533333,37.05,No,White,Surface,WAXING CRESCENT,18.99
60,1988-04-24,NULL,San Luis Obispo,Morro Rock,Surfing / Boarding,none,surface,White,"Per McCosker and Lea in Klimley 2003, the surfer was not injured""""""""",-120.975,35.40333333,No,White,Surface,WAXING GIBBOUS,57.96
61,1988-08-11,9:00:00,Del Norte,Klamath River,Surfing / Boarding,minor,surface,White,Shark bit board and surfer with injuries to thigh and buttocks,-124.0883333,41.56166667,No,White,Surface,NEW,0.69
62,1989-01-26,10:15:00,Los Angeles,Malibu,Kayaking / Canoeing,fatal,surface,White,"Two Kayakers, one found with injuries consistent with white shark attack",-118.8833333,34.01833333,Yes,White,Surface,WANING GIBBOUS,79.79
63,1989-09-09,12:00:00,Island - Farallones,Farallon Islands,Hookah Diving,major,25,White,Diver bitten in leg on descent,-123.5316667,37.72,No,White,21-30,WAXING GIBBOUS,62.53
64,1990-01-12,NULL,San Mateo,Montara,Surfing / Boarding,none,surface,White,"Shark rammed surfboard from below, no injuries",-122.5183333,37.55833333,No,White,Surface,FULL,97.24
65,1990-08-28,17:00:00,Humboldt,Trinidad Head,Surfing / Boarding,minor,surface,White,Shark knocked surfer off board and bit board and surfer's leg,-124.15,41.05833333,No,White,Surface,WAXING GIBBOUS,53.34
66,1990-09-05,17:00:00,Humboldt,Trinidad State Beach,Kayaking / Canoeing,none,surface,White,"Shark knocked kayaker into water, no injuries",-124.25,41.05833333,No,White,Surface,FULL,100
67,1990-09-08,13:00:00,Sonoma,North of Jenner,Freediving,major,surface,White,Shark bit diver and carried him through the water with injuries to head and face,-123.175,38.475,No,White,Surface,WANING GIBBOUS,83.87
68,1990-11-03,15:00:00,Monterey,Monastery Beach,Scuba Diving,major,surface,White,Shark bit diver on surface with injuries to leg / Eloise Tavares CDFW,-122.2266667,36.52666667,No,White,Surface,FULL,99.15
69,1991-07-01,9:30:00,Santa Cruz,Davenport,Surfing / Boarding,major,surface,White,Surfer attacked with major injuries to leg and arms,-122.3533333,37.05,No,White,Surface,WANING GIBBOUS,82.21
70,1991-10-05,7:30:00,Santa Cruz,"Davenport, Scott Creek, 1 mi north",Surfing / Boarding,major,surface,White,Shark attacked surfer with major injuries to arms and shoulders,-122.4533333,37.05,No,White,Surface,WANING CRESCENT,6.17
71,1991-10-09,NULL,Marin,Point Reyes,Hookah Diving,none,25,White,"Shark approached diver and grabbed his scooter as the diver positioned it in front, then tangled in hose before returning for a pass",-122.99694,37.983,No,White,21-30,NEW,3.6
72,1991-12-04,15:00:00,Humboldt,Shelter Cove,Hookah Diving,none,surface,White,"Shark hit diver and grabbed hose, dragging through water without injuries",-124.0833333,40.02833333,No,White,Surface,NEW,2.08
73,1992-08-18,20:15:00,Del Norte,Klamath River,Surfing / Boarding,none,surface,White,Shark grabbed surfboard and tossed diver without injuries,-124.1883333,41.56166667,No,White,Surface,WANING GIBBOUS,76.65
74,1992-10-29,11:00:00,Island - San Miguel,Castle Rock,Hookah Diving,minor,47,White,Shark grabbed diver's fin and foot underwater. Minor injuries to foot.,-120.6366667,34.04,No,White,41+,WAXING CRESCENT,16.59
75,1992-11-11,14:00:00,Island - San Nicolas,San Nicolas Island,Scuba Diving,minor,72,Unknown,"Shark grabbed diver's fin and foot underwater. Minor injuries to foot. Possibly thresher or soupfin, seen earlier",-119.5383333,33.22666667,No,Other,41+,FULL,98.09
76,1992-11-14,13:00:00,San Mateo,Ano Nuevo State Reserve,Kayaking / Canoeing,none,surface,White,"Shark grabbed kayak and shook it, without injuring occupant",-122.4433333,37.10833333,No,White,Surface,WANING GIBBOUS,79.46
77,1992-11-29,15:30:00,San Diego,San Onofre State Beach,Freediving,minor,surface,Unknown,"Shark bit spearfisherman's leg with lacerations and punctures. Possible mako or white, survivor claims mako",-117.6,33.37,No,Other,Surface,WAXING CRESCENT,26.79
78,1993-03-12,14:30:00,San Mateo,San Pedro Point,Freediving,none,15,White,Shark grabbed diver's fin with no injury,-122.517,37.59666667,No,White,11-20,WANING GIBBOUS,75.51
79,1993-08-12,14:00:00,Mendocino,Fort Bragg - Abalone Point,Freediving,major,5,White,"Shark grabbed diver's head and shoulders with major injuries to shoulder, neck and face",-123.785,39.66666667,No,White,0-10,WANING CRESCENT,30.21
80,1993-10-10,14:30:00,Sonoma,"Jenner, Goat Rock Beach",Kayaking / Canoeing,none,surface,White,"Shark hit kayak, ejecting occupant without injury",-123.1333333,38.43666667,No,White,Surface,WANING CRESCENT,30.22
82,1994-12-09,9:00:00,Island - San Miguel,Harris Point,Hookah Diving,fatal,Unknown,White,Diver surfaced yelling for help. Wounds to leg were severe and died from blood loss enroute to hospital,-120.7366667,34.04,Yes,White,Unknown,WAXING CRESCENT,48.09
83,1995-06-24,NULL,San Diego,La Jolla,Kayaking / Canoeing,minor,surface,White,"Kayaker was bitten in head, with shark tooth removed from face, little detail available",-117.48,32.855,No,White,Surface,WANING CRESCENT,9.91
84,1995-06-30,17:30:00,Monterey,"Point Lobos, outer Bluefish Cove",Scuba Diving,major,40,White,"Diver using underwater scooter observed shark underwater then was struck with injuries to arm, abdomen and leg",-122.0266667,36.52666667,No,White,31-40,WAXING CRESCENT,6.37
85,1995-09-03,16:00:00,Humboldt,Shelter Cove,Freediving,major,surface,White,Shark grabbed diver injuring lower leg with punctures to bone,-124.1833333,40.02833333,No,White,Surface,WAXING GIBBOUS,64.75
86,1995-09-28,17:30:00,Santa Cruz,Davenport Landing,Surfing / Boarding,minor,surface,White,Sharked knocked windsurfer into water with witnesses. lea/Mccosker have date as 9/29,-122.5533333,37.05,No,White,Surface,WAXING CRESCENT,18.73
87,1996-08-13,11:15:00,Marin,"Tomales Point, Bird Rock",Freediving,major,18,White,"Diver saw shark which immediately turned and grabbed diver. Major lacerations to shoulder, arm",-123.765,38.18166667,No,White,11-20,NEW,0
88,1996-10-03,7:30:00,Sonoma,Salmon Creek Beach,Surfing / Boarding,none,surface,White,"Shark swam at surfer and repeatedly bumped board, following surfer towards shore.",-123.1766667,38.35833333,No,White,Surface,WANING GIBBOUS,58.1
89,1996-10-05,13:00:00,Marin,Dillon Beach,Surfing / Boarding,major,surface,White,Shark attacked surfer with major injuries to leg. Continued circling after attack,-122.9716667,38.25,No,White,Surface,WANING CRESCENT,38.93
90,1996-11-29,8:30:00,Sonoma,Salmon Creek Beach,Surfing / Boarding,minor,surface,White,Shark bit surfer's shin then grabbed board with minor injury to shin,-123.2766667,38.35833333,No,White,Surface,WANING GIBBOUS,80.66
91,1997-08-24,NULL,Humboldt,Moonstone Beach,Surfing / Boarding,major,surface,White,"Shark bit surfer's leg, hand, and board with major injuries to thigh",-124.3116667,41.025,No,White,Surface,WANING GIBBOUS,54.5
92,1998-08-26,14:15:00,Marin,Stinson Beach,Surfing / Boarding,major,surface,White,"Shark bit boogie boarder, dragging him underwater. Major injuries to thighs and legs.",-122.645,37.89666667,No,White,Surface,WAXING CRESCENT,18.93
93,1999-11-15,NULL,Santa Cruz,Waddell Reef,Surfing / Boarding,none,surface,White,Shark grabbed surfers board leaving impressions but no injury to surfer,-122.28333,37.09583,No,White,Surface,WAXING CRESCENT,43.71
94,2000-09-29,9:00:00,San Mateo,"Half Moon Bay, Pillar Point",Surfing / Boarding,none,surface,White,"Shark grabbed surfboard from below, missing surfer but minor scratches and cut to wetsuit.",-122.599,37.492,No,White,Surface,NEW,4.25
97,2002-05-31,14:00:00,Marin,"Stinson Beach, off Bolinas Lagoon",Surfing / Boarding,major,surface,White,Shark attacked surfer from below with major injuries to both thighs,-122.745,37.89666667,No,White,Surface,WANING GIBBOUS,71.84
98,2002-09-21,NULL,Humboldt,Moonstone Beach,Surfing / Boarding,none,surface,White,"Shark grabbed surfer's board, no injuries",-124.4116667,41.025,No,White,Surface,FULL,100
99,2002-11-28,9:45:00,Sonoma,Salmon Creek Beach,Surfing / Boarding,major,surface,White,Shark grabbed surfer from below with major injuries to thigh,-123.3766667,38.35833333,No,White,Surface,WANING CRESCENT,38.06
100,2003-08-19,8:30:00,San Luis Obispo,Avila Beach,Swimming,fatal,surface,White,Shark grabbed woman Swimming on surface in group of seals. Major injuries including femoral artery - fatal,-120.7,35.2,Yes,White,Surface,WANING GIBBOUS,53.29
101,2004-05-28,11:00:00,Sonoma,Salmon Creek Beach,Surfing / Boarding,none,surface,White,"Shark bumped surfer, then thrashed and circled several times, No injury",-123.4766667,38.35833333,No,White,Surface,WAXING GIBBOUS,63.89
102,2004-06-26,9:00:00,San Diego,San Onofre State Beach,Surfing / Boarding,none,surface,White,"Shark struck surfer's board twice, no injury",-117.7,33.37,No,White,Surface,WAXING GIBBOUS,59.32
103,2004-08-15,16:30:00,Mendocino,Kibesillah Rock,Freediving,fatal,surface,White,Shark bit diver on descent with immediate fatal injuries. Body found next day.,-123.7783333,39.57833333,Yes,White,Surface,NEW,0
105,2004-10-01,13:45:00,Orange,"Huntington Beach, Tower 16",Surfing / Boarding,none,surface,White,"No injury, shark struck board & spun it around",-118,33.7,No,White,Surface,WANING GIBBOUS,89.69
106,2004-10-02,15:30:00,San Luis Obispo,Pismo Beach,Surfing / Boarding,none,surface,White,"No injury, knocked off surfboard, surfboard had bite marks",-120.7466667,35.13833333,No,White,Surface,WANING GIBBOUS,82.89
107,2004-10-10,9:30:00,Marin,Limantour Beach,Surfing / Boarding,minor,surface,White,Shark bit surfer's leg with minor injuries to calf,-122.886,38.024,No,White,Surface,WANING CRESCENT,13.21
109,2005-08-24,11:00:00,San Diego,La Jolla,Surfing / Boarding,minor,surface,White,"Shark bit surfer's leg when he stepped off board in shallow water, shark observed looked like small white",-117.58,32.855,No,White,Surface,WANING GIBBOUS,70.03
110,2005-10-19,11:00:00,Sonoma,Salmon Creek Beach,Surfing / Boarding,major,surface,White,"Shark bit surfer from below, pushing up out of water. Major injuries to hip and thighs",-123.5766667,38.35833333,No,White,Surface,WANING GIBBOUS,94.21
111,2005-10-21,11:00:00,Del Norte,Klamath River Mouth,Surfing / Boarding,minor,surface,White,"Shark hit surfer's board and pushed him off, small cut to thigh",-124.2883333,41.56166667,No,White,Surface,WANING GIBBOUS,80.8
112,2005-11-02,16:45:00,San Mateo,"Half Moon Bay, Mavericks",Surfing / Boarding,none,surface,White,"Shark hit board from beneath, pushing surfer off and leaving a tooth and dent in board",-122.699,37.492,No,White,Surface,NEW,0
113,2005-11-02,7:15:00,San Francisco,Ocean Beach,Surfing / Boarding,none,surface,White,"No injury, Board bumped, surfer saw fin after hitting shark",-122.518,37.74,No,White,Surface,NEW,0
115,2006-06-17,11:10:00,Monterey,Monterey,Scuba Diving,none,submerged,White,"No injury, shark bit Scuba Diving tank boot, shark not seen - presumed white",-121.85,36.62666667,No,White,Submerged,WANING GIBBOUS,51.49
116,2006-12-10,12:00:00,Marin,Dillon Beach,Surfing / Boarding,minor,surface,White,Shark bit board from below with minor nicks to the surfer's thigh,-123.0716667,38.25,No,White,Surface,WANING GIBBOUS,67.85
117,2007-06-30,10:00:00,Los Angeles,Will Rogers State Beach,Swimming,minor,surface,Unknown,"Swimmers hand bitten while swimming. Minor abrasions to hand. Unknown species, possibly blue/mako/juvenile white",-118.54,34.03,No,Other,Surface,FULL,100
118,2007-07-17,11:00:00,Ventura,Faria Beach,Swimming,minor,surface,Unknown,Swimmer's foot was bitten by unseen animal. Minor abrasions to foot,-119.391,34.318,No,Other,Surface,WAXING CRESCENT,10.99
119,2007-07-21,10:15:00,San Mateo,Pigeon Point/Bean Hollow,Kayaking / Canoeing,none,surface,White,"Shark struck front of kayak, no injury",-122.6083333,37.19166667,No,White,Surface,WAXING CRESCENT,44.4
120,2007-07-22,9:00:00,Los Angeles,Malibu,Paddleboarding,none,surface,White,"Stand-up Paddle boarder was followed then repeatedly bumped by white shark, no injuries",-118.9833333,34.01833333,No,White,Surface,WAXING GIBBOUS,53.8
121,2007-07-28,23:00:00,San Diego,Imperial Beach,Surfing / Boarding,none,surface,Unknown,"Shark jumped out of water landing on and biting board, no injury",-117.3466667,32.58833333,No,Other,Surface,FULL,97.7
122,2007-08-28,11:00:00,Monterey,Marina State Beach,Surfing / Boarding,major,surface,White,"Shark grabbed surfer and board, dragging underwater. Major injuries to torso and thighs",-121.8,36.7,No,White,Surface,FULL,100
123,2007-09-27,12:00:00,Humboldt,Moonstone Beach,Surfing / Boarding,none,surface,White,"Shark bit tail of surfboard, leaving impression, surfer uninjured",-124.5116667,41.025,No,White,Surface,FULL,98.91
124,2007-09-30,11:30:00,Los Angeles,Santa Monica,Surfing / Boarding,minor,surface,Unknown,"Puncture wound to foot, surfer witnessed small sharks (possibly leopard) but wound likely stingray",-118.502,34.004,No,Other,Surface,WANING GIBBOUS,79.55
125,2007-10-07,20:30:00,Los Angeles,Venice Pier,Surfing / Boarding,minor,surface,Leopard,"4 scratches on left hand; shark described as small and brown, possibly leopard",-118.469,33.978,No,Other,Surface,WANING CRESCENT,11.42
126,2008-03-07,7:00:00,Orange,Huntington Beach,Surfing / Boarding,none,surface,White,"No injury to surfer, surfboard bitten by the shark",-118.1,33.7,No,White,Surface,NEW,0
127,2008-04-25,7:00:00,San Diego,Solana Beach,Swimming,fatal,surface,White,"Swimmer bitten by large shark with major injuries to both thighs, Fatal",-117.3,33,Yes,White,Surface,WANING GIBBOUS,77.03
128,2008-06-21,9:00:00,Island - Catalina,West Cove,Kayaking / Canoeing,none,surface,White,"No injury. Shark bumped kayak, flinging her into the  water",-118.4163,33.3879,No,White,Surface,WANING GIBBOUS,92.11
129,2008-09-08,10:30:00,Santa Barbara,"Surf Beach, Lompoc",Surfing / Boarding,none,surface,White,"No injury to surfer, board bitten",-120.61,34.683,No,White,Surface,WAXING GIBBOUS,60.17
130,2009-04-06,7:00:00,San Diego,San Diego,Freediving,none,surface,White,Shark struck him but the diver was not injured,-117.274,32.817,No,White,Surface,WAXING GIBBOUS,89.9
131,2009-08-25,16:30:00,San Diego,Terramar Beach,Swimming,minor,surface,White,Puncture wounds to left foot & calf,-117.3,33.1,No,White,Surface,WAXING CRESCENT,31.97
132,2009-08-30,18:30:00,Orange,Huntington Beach,Surfing / Boarding,none,surface,White,"Shark bumped board then was witnessed in wave afterward, No Injury",-118.2,33.7,No,White,Surface,WAXING GIBBOUS,78.63
